"","Keyword","Context"
"1","wild","Antúnez1 Honeybees Apis mellifera are important pollinators of wild plants and commercial crops. "
"2","wild","In particular, honeybees (Apis mellifera) are among the most important insect pollinator in temperate and tropical areas, promoting the sexual reproduction of wild plants and commercial crops5,6. "
"3","adaptation","Open Access This article is licensed under a Creative Commons Attribution 4.0 International License, which permits use, sharing, adaptation, distribution and reproduction in any medium or format, as long as you give appropriate credit to the original author(s) and the source, provide a link to the Creative Commons license, and indicate if changes were made. "
"4","model","Eucalyptus spp. plantations provide an ideal natural model to study the impact of nutritional stress on honeybee health since its pollen has a low crude protein percentage33,35, low lipid content36 and is deficient in isoleucine35,37. "
"5","model","Generalized linear mixed models (GLMM) were used to assess the relationship between time/treatment and colony strength/pathogen infection. "
"6","model","Generalized linear mixed models (GLMM) were used to assess the relationship between treatment (M or P) and time (both as fixed effects), and colony strength and pathogen infection levels 9Scientific RepoRts | (2019) 9:10156 | https://doi.org/10.1038/s41598-019-46453-9 www.nature.com/scientificreportswww.nature.com/scientificreports/ (as dependent variables) (package {lme4})82,83. "
"7","model","The identity of the colonies was considered as a random effect, and random intercept or slope was chosen in each model according to the variability of each dependent variable intra and inter colony, respectively. "
"8","model","A new mathematical model for relative quantification in real-time RT-PCR. "
