"","Keyword","Context"
"106","wild","E. coli and other Enterobacterales such as Klebsiella spp. found in the farm environment (e.g. rats, flies, wild animals, manure/litter) are also often multidrug resistant, including to extended spectrum cephalosporins and fluoroquinolones, and some can persist in poultry farm and hatchery environments AMR in food-producing environment www.efsa.europa.eu/efsajournal 177 EFSA Journal 2021;19(6):6651 (Sola-Gines et al., 2015; Himsworth et al., 2016; Kaspersen et al., 2020a,b; Zhai et al., 2020) and spread between different flocks despite biosecurity precautions (Burow et al., 2020). "
"107","wild","The presence of waterfowl within 1 km of German broiler, pig, dairy or beef cattle farms was associated with changes in the ESBL gene families and the resistance phenotypes of cefotaxime-resistant E. coli in farm animals and in wild game in the area surrounding the farm (Hille et al., 2018a). "
"108","wild","Resistance has been observed in the absence of selective pressure perhaps because specific antimicrobial resistant strains and or genetic elements might be spreading to soils and crops and, from there, further disseminated by wildlife (O’Brien, 2002). "
"109","wild","In general Campylobacter is found in the gut flora of different food and wild animal species, including cattle, but also show some degree of host specificity. "
"110","wild","Mammalian and avian wildlife also represent a threat for the introduction of AMR Salmonella into the food chain (de Lucia et al., 2018). "
"111","wild","E.g. various serovars carrying AMR and mobile genetic elements have been isolated from wild boar (Caleja et al., 2011; Zottola et al., 2013; Leekitcharoenphon et al., 2019). "
"112","wild","Moreover, different MRSA lineages, including ST398, have been reported in different wild animals across Europe (Heaton et al., 2020). "
"113","wild","Studies in wild boar have reported the presence of MDR Salmonella serovars carrying genes such as blaTEM-1 (Leekitcharoenphon et al., 2019) or blaPSE-1 gene cassettes (Caleja et al., 2011) within class 1 integrons. "
"114","wild","Some attention was given to genes reported in aquatic environments and in wild fish and shellfish, given the extremely small number of studies focusing on farmed fish and shellfish (Roschanski et al., 2017a). "
"115","wild","Due to the small amount of available literature and the difficulty of attributing environmental origins of ARB from point of sale fish and shellfish produced in Europe, studies of wild fish and shellfish have been included as they may represent useful proxies for farmed fish in the absence of data on AMR in aquaculture production systems. "
"116","wild","AMR in food-producing environment www.efsa.europa.eu/efsajournal 183 EFSA Journal 2021;19(6):6651 A study of wild fish from the Algerian Mediterranean Sea reported carriage of ESBLproducing E. coli, K. pneumoniae, Enterobacter cloacae complex, Morganella morganii, Citrobacter freundii complex and Proteus vulgaris in 21.3% (64/300) fish samples predominantly bearing blaCTX-M. "
"117","wild","A study of wild freshwater fish in France reported ESBL E. coli in 0–85% of fish depending on sample site and species and this was associated with proximity to human faecal pollution (Bollache et al., 2019). "
"118","wild","Studies have also focused on wild gilthead sea bream in Portugal, where 5/118 (4.2%) faecal samples contained ESBL-positive E. coli which carried blaTEM-52 or blaSHV-12 genes (Sousa et al., 2011). "
"119","wild","Further studies of wild-growing Mediterranean mussels demonstrated carriage of Aeromonas spp. isolates with blaCTX-M-15 and/or blaSHV-12 or blaFOX-2 gene (Maravic et al., 2013). "
"120","wild","A recent systematic review by Bonardi and Pitino (2019) focused on carbapenemase-producing bacteria in food-producing animals, including fish and molluscs, but only one report in wild venus clams collected from retail in Germany, and originating from the Italian Mediterranean was included, with blaVIM-1 described in E. coli (Roschanski et al., 2017a). "
"121","fitness","Moreover, bacterial characteristics, such as resilience/stress response capability, biofilm formation, ARG transferability, ARG co-localisation with other ARGs or heavy metal/biocide tolerance genes in the same genetic platform, as well as mechanisms to minimise the ARGs’ fitness cost may also be relevant. "
"122","fitness","It was thought that ARGs would impose a fitness cost, and thus at antimicrobial concentrations below the MSC-resistant bacteria carrying the ARG would be outcompeted by non-resistant bacteria. "
"123","fitness","However, recent evidence suggests that several ARGs may impose a low fitness cost, be cost free (sometimes involving development of compensatory mechanisms), or in some cases confer a fitness benefit (Andersson and Hughes, 2010; Li et al., 2020; Kloos et al., 2021; Pietsch et al., 2021). "
"124","fitness","Consequently, ARBs may persist within microbial communities for a duration related to the fitness cost of AMR and general ability to compete with other microorganisms, in some cases decreasing over time and in others persisting, or actually increasing, even in the absence of antimicrobial selection (Li et al., 2020; Perrin-Guyomard et al., 2020; Kloos et al., 2021). "
"125","fitness","Co-selection of virulence traits (e.g. by location of virulence and resistance in the same plasmid), upregulation of virulence genes or improved fitness of the bacteria are possible mechanisms underlying the enhanced virulence of clones that have acquired an ARG (Mølbak, 2005; Pan et al., 2020). "
"126","fitness","Those plasmids seem to have a high fitness cost, thus maintenance associated with a persistent selective pressure. "
"127","fitness","It is often assumed that there will be a fitness cost to maintenance of ARGs that will reduce persistence of ARB, but this is not the case where there are compensatory mechanisms and the fitness cost can vary in different environments (Clarke et al., 2020). "
"128","fitness","Infantis is also of interest because of the involvement of a promiscuous pESI-like megaplasmid (Alba et al., 2020; Szmolka et al., 2021) that encompasses AMR and virulence/fitness traits (including toxinantitoxin systems) that are thought to have been involved in the rapid international dissemination of various clones in the broiler industry via environmental routes, despite limited involvement of the AMR in food-producing environment www.efsa.europa.eu/efsajournal 86 EFSA Journal 2021;19(6):6651 breeding sector, and possibly also selected by the regular use of preventive antimicrobials for chicks prior to recent prudent use initiatives (EFSA, 2019; Alba et al., 2020). "
"129","fitness","Moreover, transferability of ARGs, location of ARGs conferring resistance to different antimicrobials on the same genetic platform (e.g. chromosome, plasmid or genomic island encoding a gene conferring another resistance determinant), or on the same MGE as genes conferring metal and/or biocide tolerance and involved in stress response, biofilm formation and virulence, as well as compensatory mechanisms to minimise the fitness cost of replicating ARGs, are all relevant to the successful extension and persistence of ARB. "
"130","fitness","• What is the genetic basis for ‘fitness’, in relation to persistence of ARB in the production environment throughout the food production chain? "
"131","fitness","• Presence of bacterial traits linked to the general resilience (e.g. resistance to desiccation, temperature), biofilm formation, stress response, virulence, compensation of fitness costs and co-location of ARGs and/or genes conferring tolerance to heavy metals or biocides on the same genetic platform (e.g. plasmid) could enhance their occurrence and persistence in the food production environment. "
"132","fitness","The effect of environmental heterogeneity on the fitness of antibiotic resistance mutations in Escherichia coli. "
"133","fitness","Plasmids persist in a microbial community by providing fitness benefit to multiple phylotypes. "
"134","fitness","Genome-based analyses of fitness effects and compensatory changes associated with acquisition of blaCMY-, blaCTX-M-, and blaOXA-48/VIM-1-containing plasmids in Escherichia coli. "
"135","fitness","1).44 A fitness check evaluation of this Directive was published in 2019,45 as a result of which, impact assessment being prepared for daughter directives on groundwater 2006/118/EC and environmental quality standards 2008/105/EC cited below. "
"136","fitness","uri=cellar:5c835afb-2ec6-4577-bdf8-756d3d694eeb.0004.02/DOC_1&format=PDF 45 https://ec.europa.eu/environment/water/fitness_check_of_the_eu_water_legislation/documents/Water%20Fitness%20Check% 20-%20SWD(2019)439%20-%20web.pdf 46 https://eur-lex.europa.eu/legal-content/EN/TXT/PDF/?"
"137","fitness","Resistance to newer antimicrobials such glycylcyclines, ceftazidime/avibactam or oxazolidinones may become greater threats in future if transferrable resistance linked to fitness traits emerges in bacteria associated with poultry, or come from human sources and are co-selected through the common use of certain antimicrobials, such as tetracyclines or florfenicol (Freitas et al., 2011b; Wang et al., 2020a). "
"138","adaptation","This is an open access article under the terms of the Creative Commons Attribution-NoDerivs License, which permits use and distribution in any medium, provided the original work is properly cited and no modifications or adaptations are made. "
"139","adaptation","Bacterial virulence and host adaptation features are also part of the intricate network of several factors responsible for the evolution, transmission and maintenance of ARB. "
"140","adaptation","Potential impact of biocide adaptation on selection of antibiotic resistance in bacterial isolates. "
"141","adaptation","Piggybacking on niche-adaptation improves the maintenance of multidrug resistance plasmids. "
"142","adaptation","AMR acquisition by several Salmonella serovars might be partially responsible for the enhanced virulence of certain strains and/or adaptation to different environments (Singer and Hofacre, 2006; Nde and Logue , 2008). "
